{"$schema":"https://json-schema.org/draft/2020-12/schema","type":"object","additionalProperties":false,"required":["$contract","meta","schema","payload","quality"],"properties":{"$contract":{"type":"object","additionalProperties":false,"required":["envelope","envelope_version","profile","profile_version"],"properties":{"envelope":{"const":"quantskills-envelope"},"envelope_version":{"const":"1.0.0"},"profile":{"type":"string","pattern":"^[a-z0-9]+(?:-[a-z0-9]+)*$"},"profile_version":{"type":"string","pattern":"^[0-9]+[.][0-9]+[.][0-9]+$"}}},"meta":{"type":"object","additionalProperties":false,"required":["dataset_id","producer","generated_at","provenance"],"properties":{"dataset_id":{"type":"string","minLength":1},"producer":{"type":"string","minLength":1},"generated_at":{"$ref":"#/$defs/dateTime"},"as_of":{"$ref":"#/$defs/dateTime"},"timezone":{"type":"string","minLength":1},"currency":{"type":"string","minLength":1},"calendar":{"type":"string","minLength":1},"provenance":{"type":"array","minItems":1,"items":{"type":"object","additionalProperties":false,"required":["provider","dataset","raw_ref","raw_sha256"],"properties":{"provider":{"type":"string","minLength":1},"dataset":{"type":"string","minLength":1},"raw_ref":{"type":"string","minLength":1},"raw_sha256":{"type":"string","pattern":"^sha256:[0-9a-f]{64}$"}}}}}},"schema":{"type":"object","additionalProperties":false,"required":["primary_key","fields"],"properties":{"primary_key":{"type":"array","minItems":1,"uniqueItems":true,"items":{"type":"string","minLength":1}},"fields":{"type":"object","minProperties":1,"additionalProperties":{"$ref":"#/$defs/field"}}}},"payload":{"type":"object","additionalProperties":false,"required":["native","records"],"properties":{"native":{"type":"object","additionalProperties":false,"properties":{"provider":{"type":"string","minLength":1},"fields":{"type":"array","items":{"type":"string"}},"raw_ref":{"type":"string","minLength":1},"raw_records":{"type":"array","items":{"type":"object"}}},"anyOf":[{"required":["raw_ref"]},{"required":["raw_records"]}]},"records":{"type":"array","items":{"type":"object"}}}},"quality":{"type":"object","additionalProperties":false,"required":["status","checks","warnings"],"properties":{"status":{"enum":["pass","warning","fail"]},"checks":{"type":"array"},"warnings":{"type":"array"}}}},"$defs":{"dateTime":{"type":"string","format":"date-time","pattern":"(?:Z|[+-][0-9]{2}:[0-9]{2})$"},"field":{"type":"object","additionalProperties":false,"required":["type"],"properties":{"type":{"enum":["string","number","integer","boolean","object","array"]},"format":{"type":"string"},"unit":{"type":"string","minLength":1},"nullable":{"type":"boolean"},"description":{"type":"string"}}}}}
