{"$contract":{"envelope":"quantskills-envelope","envelope_version":"1.0.0","profile":"evaluation-result","profile_version":"1.0.0"},"meta":{"dataset_id":"synthetic-evaluation-result","producer":"registry-fixture","generated_at":"2026-08-10T09:30:00Z","as_of":"2026-08-10T09:30:00Z","timezone":"UTC","currency":"CNY","calendar":"SYNX","provenance":[{"provider":"synthetic-provider","dataset":"evaluation-result","raw_ref":"fixture://evaluation-result/001","raw_sha256":"sha256:0000000000000000000000000000000000000000000000000000000000000000"}]},"schema":{"primary_key":["subject_id","evaluated_at"],"fields":{"subject_id":{"type":"string","nullable":false},"evaluated_at":{"type":"string","nullable":false,"format":"date-time"},"sample_start":{"type":"string","nullable":false,"format":"date"},"sample_end":{"type":"string","nullable":false,"format":"date"},"metrics":{"type":"object","nullable":false},"verdict":{"type":"string","nullable":false},"evidence":{"type":"array","nullable":false},"lineage":{"type":"object","nullable":false}}},"payload":{"native":{"provider":"synthetic-provider","raw_ref":"fixture://evaluation-result/001"},"records":[{"subject_id":"strategy-001","evaluated_at":"2026-08-10T09:30:00Z","sample_start":"2026-01-01","sample_end":"2026-06-30","metrics":{"sharpe":1.2},"verdict":"pass","evidence":["evidence://evaluation/001"],"lineage":{"sources":[{"profile":"backtest-result","version":"1.0.0","artifact_ref":"artifact://backtest-result/001","sha256":"sha256:0000000000000000000000000000000000000000000000000000000000000000"}],"evidence_refs":["evidence://backtest-result/001"]}}]},"quality":{"status":"pass","checks":["synthetic"],"warnings":[]}}
