{"$contract":{"envelope":"quantskills-envelope","envelope_version":"1.0.0","profile":"risk-result","profile_version":"1.0.0"},"meta":{"dataset_id":"synthetic-risk-result","producer":"registry-fixture","generated_at":"2026-08-10T09:30:00Z","as_of":"2026-08-10T09:30:00Z","timezone":"UTC","currency":"CNY","calendar":"SYNX","provenance":[{"provider":"synthetic-provider","dataset":"risk-result","raw_ref":"fixture://risk-result/001","raw_sha256":"sha256:0000000000000000000000000000000000000000000000000000000000000000"}]},"schema":{"primary_key":["subject_id","as_of"],"fields":{"subject_id":{"type":"string","nullable":false},"subject_type":{"type":"string","nullable":false},"as_of":{"type":"string","nullable":false,"format":"date-time"},"exposures":{"type":"object","nullable":false},"limits":{"type":"object","nullable":false},"breaches":{"type":"array","nullable":false},"scenarios":{"type":"array","nullable":false},"lineage":{"type":"object","nullable":false}}},"payload":{"native":{"provider":"synthetic-provider","raw_ref":"fixture://risk-result/001"},"records":[{"subject_type":"portfolio","as_of":"2026-08-10T09:30:00Z","exposures":{"market_beta":1.1},"limits":{"market_beta":2},"breaches":[],"scenarios":["base"],"lineage":{"sources":[{"profile":"portfolio-target","version":"1.0.0","artifact_ref":"artifact://portfolio-target/001","sha256":"sha256:0000000000000000000000000000000000000000000000000000000000000000"}],"evidence_refs":["evidence://portfolio-target/001"]}}]},"quality":{"status":"pass","checks":["synthetic"],"warnings":[]}}
