{"$contract":{"envelope":"quantskills-envelope","envelope_version":"1.0.0","profile":"event-record","profile_version":"1.0.0"},"meta":{"dataset_id":"synthetic-event-record","producer":"registry-fixture","generated_at":"2026-08-10T09:30:00Z","as_of":"2026-08-10T09:30:00Z","timezone":"UTC","currency":"CNY","calendar":"SYNX","provenance":[{"provider":"synthetic-provider","dataset":"event-record","raw_ref":"fixture://event-record/001","raw_sha256":"sha256:0123456789abcdef0123456789abcdef0123456789abcdef0123456789abcdef"}]},"schema":{"primary_key":["event_id","event_time","entity_id"],"fields":{"event_id":{"type":"string","nullable":false},"event_time":{"type":"string","nullable":false,"format":"date-time"},"entity_id":{"type":"string","nullable":false},"event_type":{"type":"string","nullable":false},"published_at":{"type":"string","nullable":false,"format":"date-time"},"source":{"type":"string","nullable":false},"evidence_ref":{"type":"string","nullable":false},"dedupe_key":{"type":"string","nullable":false},"confidence_boundary":{"type":"string","nullable":false}}},"payload":{"native":{"provider":"synthetic-provider","raw_ref":"fixture://event-record/001"},"records":[{"event_id":"evt-001","event_time":"2026-08-10T09:30:00Z","entity_id":"entity-001","event_type":"filing","published_at":"2026-08-10T09:31:00Z","source":"synthetic","evidence_ref":"fixture://event/001","dedupe_key":"evt-001","confidence_boundary":"confirmed"}]},"quality":{"status":"pass","checks":["synthetic"],"warnings":[]}}
