{"$contract":{"envelope":"quantskills-envelope","envelope_version":"1.0.0","profile":"report-artifact","profile_version":"1.0.0"},"meta":{"dataset_id":"synthetic-report-artifact","producer":"registry-fixture","generated_at":"2026-08-10T09:30:00Z","as_of":"2026-08-10T09:30:00Z","timezone":"UTC","currency":"CNY","calendar":"SYNX","provenance":[{"provider":"synthetic-provider","dataset":"report-artifact","raw_ref":"fixture://report-artifact/001","raw_sha256":"sha256:0000000000000000000000000000000000000000000000000000000000000000"}]},"schema":{"primary_key":["report_id","as_of"],"fields":{"report_id":{"type":"string","nullable":false},"as_of":{"type":"string","nullable":false,"format":"date-time"},"media_type":{"type":"string","nullable":false},"artifact_ref":{"type":"string","nullable":false},"source_snapshot_id":{"type":"string","nullable":false},"lineage":{"type":"object","nullable":false}}},"payload":{"native":{"provider":"synthetic-provider","raw_ref":"fixture://report-artifact/001"},"records":[{"as_of":"2026-08-10T09:30:00Z","media_type":"text/markdown","artifact_ref":"artifact://report/001","source_snapshot_id":"snapshot-001","lineage":{"sources":[{"profile":"backtest-result","version":"1.0.0","artifact_ref":"artifact://backtest-result/001","sha256":"sha256:0000000000000000000000000000000000000000000000000000000000000000"}],"evidence_refs":["evidence://backtest-result/001"]}}]},"quality":{"status":"pass","checks":["synthetic"],"warnings":[]}}
