{"$contract":{"envelope":"quantskills-envelope","envelope_version":"1.0.0","profile":"execution-plan","profile_version":"1.0.0"},"meta":{"dataset_id":"synthetic-execution-plan","producer":"registry-fixture","generated_at":"2026-08-10T09:30:00Z","as_of":"2026-08-10T09:30:00Z","timezone":"UTC","currency":"CNY","calendar":"SYNX","provenance":[{"provider":"synthetic-provider","dataset":"execution-plan","raw_ref":"fixture://execution-plan/001","raw_sha256":"sha256:0000000000000000000000000000000000000000000000000000000000000000"}]},"schema":{"primary_key":["portfolio_id","as_of"],"fields":{"portfolio_id":{"type":"string","nullable":false},"as_of":{"type":"string","nullable":false,"format":"date-time"},"simulated_orders":{"type":"array","nullable":false},"constraints":{"type":"array","nullable":false},"tca_assumptions":{"type":"object","nullable":false},"live_submission_allowed":{"type":"boolean","nullable":false},"lineage":{"type":"object","nullable":false}}},"payload":{"native":{"provider":"synthetic-provider","raw_ref":"fixture://execution-plan/001"},"records":[{"as_of":"2026-08-10T09:30:00Z","simulated_orders":[{"instrument_id":"SYNTH-001","side":"buy","quantity":100,"order_type":"market"}],"constraints":["max-participation-0.1"],"tca_assumptions":{"slippage_bps":5},"live_submission_allowed":false,"lineage":{"sources":[{"profile":"portfolio-target","version":"1.0.0","artifact_ref":"artifact://portfolio-target/001","sha256":"sha256:0000000000000000000000000000000000000000000000000000000000000000"}],"evidence_refs":["evidence://portfolio-target/001"]}}]},"quality":{"status":"pass","checks":["synthetic"],"warnings":[]}}
