{"$contract":{"envelope":"quantskills-envelope","envelope_version":"1.0.0","profile":"backtest-result","profile_version":"1.0.0"},"meta":{"dataset_id":"core-chain-backtest","producer":"skill-backtest","generated_at":"2026-08-10T09:30:00Z","as_of":"2026-08-10T09:30:00Z","timezone":"UTC","currency":"CNY","calendar":"SYNX","provenance":[{"provider":"synthetic-provider","dataset":"backtest-result","raw_ref":"artifact://core-chain/portfolio","raw_sha256":"sha256:93ba78f582ec2f34963d953f9364dd576ab3a1fb6e46dc339f7e001649ac548a"}]},"schema":{"primary_key":["strategy_id","period_start","period_end"],"fields":{"strategy_id":{"type":"string","nullable":false},"period_start":{"type":"string","nullable":false,"format":"date"},"period_end":{"type":"string","nullable":false,"format":"date"},"return_series_ref":{"type":"string","nullable":false},"costs":{"type":"number","nullable":false,"unit":"currency"},"assumptions":{"type":"object","nullable":false},"bias_controls":{"type":"array","nullable":false},"lineage":{"type":"object","nullable":false}}},"payload":{"native":{"provider":"synthetic-provider","raw_ref":"fixture://core-chain/backtest"},"records":[{"strategy_id":"strategy-001","period_start":"2026-01-01","period_end":"2026-06-30","return_series_ref":"artifact://core-chain/returns","costs":0,"assumptions":{"simulation":"synthetic only"},"bias_controls":["point-in-time"],"lineage":{"sources":[{"profile":"portfolio-target","version":"1.0.0","artifact_ref":"artifact://core-chain/portfolio","sha256":"sha256:93ba78f582ec2f34963d953f9364dd576ab3a1fb6e46dc339f7e001649ac548a"}],"evidence_refs":["evidence://core-chain/portfolio"]}}]},"quality":{"status":"pass","checks":["synthetic"],"warnings":[]}}
