{"$contract":{"envelope":"quantskills-envelope","envelope_version":"1.0.0","profile":"evaluation-result","profile_version":"1.0.0"},"meta":{"dataset_id":"core-chain-evaluation","producer":"skill-backtest","generated_at":"2026-08-10T09:30:00Z","as_of":"2026-08-10T09:30:00Z","timezone":"UTC","currency":"CNY","calendar":"SYNX","provenance":[{"provider":"synthetic-provider","dataset":"evaluation-result","raw_ref":"artifact://core-chain/backtest","raw_sha256":"sha256:c9fd5a4ffbf844bb9cb15bf278c3687e4e341214b98e13dfe1cd6a35dceaa8d5"}]},"schema":{"primary_key":["subject_id","evaluated_at"],"fields":{"subject_id":{"type":"string","nullable":false},"evaluated_at":{"type":"string","nullable":false,"format":"date-time"},"sample_start":{"type":"string","nullable":false,"format":"date"},"sample_end":{"type":"string","nullable":false,"format":"date"},"metrics":{"type":"object","nullable":false},"verdict":{"type":"string","nullable":false},"evidence":{"type":"array","nullable":false},"lineage":{"type":"object","nullable":false}}},"payload":{"native":{"provider":"synthetic-provider","raw_ref":"fixture://core-chain/evaluation"},"records":[{"subject_id":"strategy-001","evaluated_at":"2026-08-10T09:30:00Z","sample_start":"2026-01-01","sample_end":"2026-06-30","metrics":{"coverage":1},"verdict":"inconclusive","evidence":["evidence://core-chain/backtest"],"lineage":{"sources":[{"profile":"backtest-result","version":"1.0.0","artifact_ref":"artifact://core-chain/backtest","sha256":"sha256:c9fd5a4ffbf844bb9cb15bf278c3687e4e341214b98e13dfe1cd6a35dceaa8d5"}],"evidence_refs":["evidence://core-chain/backtest"]}}]},"quality":{"status":"pass","checks":["synthetic"],"warnings":[]}}
