{"$contract":{"envelope":"quantskills-envelope","envelope_version":"1.0.0","profile":"fundamental-pit","profile_version":"1.0.0"},"meta":{"dataset_id":"synthetic-fundamental-pit","producer":"registry-fixture","generated_at":"2026-08-10T09:30:00Z","as_of":"2026-08-10T09:30:00Z","timezone":"UTC","currency":"CNY","calendar":"SYNX","provenance":[{"provider":"synthetic-provider","dataset":"fundamental-pit","raw_ref":"fixture://fundamental-pit/001","raw_sha256":"sha256:0123456789abcdef0123456789abcdef0123456789abcdef0123456789abcdef"}]},"schema":{"primary_key":["instrument_id","period_end","available_at","statement_scope"],"fields":{"instrument_id":{"type":"string","nullable":false},"period_end":{"type":"string","nullable":false,"format":"date"},"available_at":{"type":"string","nullable":false,"format":"date-time"},"statement_scope":{"type":"string","nullable":false},"metric_id":{"type":"string","nullable":false},"value":{"type":"number","nullable":false,"unit":"currency"},"currency":{"type":"string","nullable":false}}},"payload":{"native":{"provider":"synthetic-provider","raw_ref":"fixture://fundamental-pit/001"},"records":[{"period_end":"2026-06-30","available_at":"2026-08-10T09:30:00Z","statement_scope":"consolidated","metric_id":"synthetic-metric","value":42,"currency":"CNY"}]},"quality":{"status":"pass","checks":["synthetic"],"warnings":[]}}
