{"$contract":{"envelope":"quantskills-envelope","envelope_version":"1.0.0","profile":"market-bar","profile_version":"1.0.0"},"meta":{"dataset_id":"synthetic-market-bar","producer":"registry-fixture","generated_at":"2026-08-10T09:30:00Z","as_of":"2026-08-10T09:30:00Z","timezone":"UTC","currency":"CNY","calendar":"SYNX","provenance":[{"provider":"synthetic-provider","dataset":"market-bar","raw_ref":"fixture://market-bar/001","raw_sha256":"sha256:0123456789abcdef0123456789abcdef0123456789abcdef0123456789abcdef"}]},"schema":{"primary_key":["instrument_id","timestamp"],"fields":{"instrument_id":{"type":"string","nullable":false},"timestamp":{"type":"string","nullable":false,"format":"date-time"},"open":{"type":"number","nullable":false,"unit":"currency"},"high":{"type":"number","nullable":false,"unit":"currency"},"low":{"type":"number","nullable":false,"unit":"currency"},"close":{"type":"number","nullable":false,"unit":"currency"},"volume":{"type":"number","nullable":false,"unit":"shares"},"frequency":{"type":"string","nullable":false},"adjustment":{"type":"string","nullable":false},"calendar":{"type":"string","nullable":false}}},"payload":{"native":{"provider":"synthetic-provider","raw_ref":"fixture://market-bar/001"},"records":[{"timestamp":"2026-08-10T09:30:00Z","open":10,"high":11,"low":9,"close":10.5,"volume":1000,"frequency":"1d","adjustment":"none","calendar":"SYNX"}]},"quality":{"status":"pass","checks":["synthetic"],"warnings":[]}}
