{"$contract":{"envelope":"quantskills-envelope","envelope_version":"1.0.0","profile":"factor-panel","profile_version":"1.0.0"},"meta":{"dataset_id":"synthetic-factor-panel","producer":"registry-fixture","generated_at":"2026-08-10T09:30:00Z","as_of":"2026-08-10T09:30:00Z","timezone":"UTC","currency":"CNY","calendar":"SYNX","provenance":[{"provider":"synthetic-provider","dataset":"factor-panel","raw_ref":"fixture://factor-panel/001","raw_sha256":"sha256:0123456789abcdef0123456789abcdef0123456789abcdef0123456789abcdef"}]},"schema":{"primary_key":["instrument_id","timestamp","factor_id"],"fields":{"instrument_id":{"type":"string","nullable":false},"timestamp":{"type":"string","nullable":false,"format":"date-time"},"factor_id":{"type":"string","nullable":false},"value":{"type":"number","nullable":false,"unit":"score"},"direction":{"type":"string","nullable":false},"frequency":{"type":"string","nullable":false},"universe":{"type":"string","nullable":false},"missing_policy":{"type":"string","nullable":false},"neutralization":{"type":"string","nullable":false}}},"payload":{"native":{"provider":"synthetic-provider","raw_ref":"fixture://factor-panel/001"},"records":[{"timestamp":"2026-08-10T09:30:00Z","factor_id":"synthetic-factor","value":1.25,"direction":"higher-is-better","frequency":"1d","universe":"synthetic-universe","missing_policy":"exclude","neutralization":"none"}]},"quality":{"status":"pass","checks":["synthetic"],"warnings":[]}}
