{"$contract":{"envelope":"quantskills-envelope","envelope_version":"1.0.0","profile":"model-artifact","profile_version":"1.0.0"},"meta":{"dataset_id":"synthetic-model-artifact","producer":"registry-fixture","generated_at":"2026-08-10T09:30:00Z","as_of":"2026-08-10T09:30:00Z","timezone":"UTC","currency":"CNY","calendar":"SYNX","provenance":[{"provider":"synthetic-provider","dataset":"model-artifact","raw_ref":"fixture://model-artifact/001","raw_sha256":"sha256:0000000000000000000000000000000000000000000000000000000000000000"}]},"schema":{"primary_key":["model_id","training_cutoff"],"fields":{"model_id":{"type":"string","nullable":false},"training_cutoff":{"type":"string","nullable":false,"format":"date-time"},"feature_ids":{"type":"array","nullable":false},"artifact_ref":{"type":"string","nullable":false},"environment_hash":{"type":"string","nullable":false},"lineage":{"type":"object","nullable":false}}},"payload":{"native":{"provider":"synthetic-provider","raw_ref":"fixture://model-artifact/001"},"records":[{"model_id":"model-001","training_cutoff":"2026-08-01T00:00:00Z","feature_ids":["factor-001","factor-002"],"artifact_ref":"artifact://model/001","environment_hash":"sha256:0000000000000000000000000000000000000000000000000000000000000000","lineage":{"sources":[{"profile":"factor-panel","version":"1.0.0","artifact_ref":"artifact://factor-panel/001","sha256":"sha256:0000000000000000000000000000000000000000000000000000000000000000"}],"evidence_refs":["evidence://factor-panel/001"]}}]},"quality":{"status":"pass","checks":["synthetic"],"warnings":[]}}
