{"$contract":{"envelope":"quantskills-envelope","envelope_version":"1.0.0","profile":"holdings","profile_version":"1.0.0"},"meta":{"dataset_id":"synthetic-holdings","producer":"registry-fixture","generated_at":"2026-08-10T09:30:00Z","as_of":"2026-08-10T09:30:00Z","timezone":"UTC","currency":"CNY","calendar":"SYNX","provenance":[{"provider":"synthetic-provider","dataset":"holdings","raw_ref":"fixture://holdings/001","raw_sha256":"sha256:0123456789abcdef0123456789abcdef0123456789abcdef0123456789abcdef"}]},"schema":{"primary_key":["portfolio_id","instrument_id","as_of"],"fields":{"portfolio_id":{"type":"string","nullable":false},"instrument_id":{"type":"string","nullable":false},"as_of":{"type":"string","nullable":false,"format":"date-time"},"quantity":{"type":"number","nullable":false,"unit":"shares"},"weight":{"type":"number","nullable":false,"unit":"ratio"},"cost":{"type":"number","nullable":false,"unit":"CNY"},"currency":{"type":"string","nullable":false},"portfolio_nav":{"type":"number","nullable":false,"unit":"CNY"}}},"payload":{"native":{"provider":"synthetic-provider","raw_ref":"fixture://holdings/001"},"records":[{"portfolio_id":"portfolio-001","instrument_id":"SYNTH-001","as_of":"2026-08-10T09:30:00Z","quantity":100,"weight":0.1,"cost":10,"currency":"CNY","portfolio_nav":10000}]},"quality":{"status":"pass","checks":["synthetic"],"warnings":[]}}
