{"$contract":{"envelope":"quantskills-envelope","envelope_version":"1.0.0","profile":"portfolio-target","profile_version":"1.0.0"},"meta":{"dataset_id":"core-chain-portfolio","producer":"skill-portfolio-optimize","generated_at":"2026-08-10T09:30:00Z","as_of":"2026-08-10T09:30:00Z","timezone":"UTC","currency":"CNY","calendar":"SYNX","provenance":[{"provider":"skill-factor-grouped-wrapper","dataset":"ranking","raw_ref":"artifact://core-chain/ranking","raw_sha256":"sha256:2deb5d6ba8af39441cb73e42ec44ae34fa453b2085bbc8623f9d4b8aaa489a08"}]},"schema":{"primary_key":["portfolio_id","as_of"],"fields":{"portfolio_id":{"type":"string","nullable":false},"as_of":{"type":"string","nullable":false,"format":"date-time"},"target_weights":{"type":"object","nullable":false},"cash_target":{"type":"number","nullable":false,"unit":"ratio"},"constraints":{"type":"array","nullable":false},"lineage":{"type":"object","nullable":false}}},"payload":{"native":{"provider":"synthetic-provider","raw_ref":"fixture://core-chain/portfolio"},"records":[{"portfolio_id":"portfolio-001","as_of":"2026-08-10T09:30:00Z","target_weights":{"SYNTH-001":0.6},"cash_target":0.4,"constraints":["long-only"],"lineage":{"sources":[{"profile":"ranked-factor-set","version":"1.0.0","artifact_ref":"artifact://core-chain/ranking","sha256":"sha256:2deb5d6ba8af39441cb73e42ec44ae34fa453b2085bbc8623f9d4b8aaa489a08"}],"evidence_refs":["evidence://core-chain/ranking"]}}]},"quality":{"status":"pass","checks":["synthetic"],"warnings":[]}}
