{"$contract":{"envelope":"quantskills-envelope","envelope_version":"1.0.0","profile":"execution-plan","profile_version":"1.0.0"},"meta":{"dataset_id":"core-chain-execution","producer":"skill-ssquant-ai-trader","generated_at":"2026-08-10T09:30:00Z","as_of":"2026-08-10T09:30:00Z","timezone":"UTC","currency":"CNY","calendar":"SYNX","provenance":[{"provider":"skill-backtest","dataset":"evaluation","raw_ref":"artifact://core-chain/evaluation","raw_sha256":"sha256:a5e00610e698e8c6de133170f5a771376694ffa30bccf110d70b2b79cb568383"}]},"schema":{"primary_key":["portfolio_id","as_of"],"fields":{"portfolio_id":{"type":"string","nullable":false},"as_of":{"type":"string","nullable":false,"format":"date-time"},"simulated_orders":{"type":"array","nullable":false},"constraints":{"type":"array","nullable":false},"tca_assumptions":{"type":"object","nullable":false},"live_submission_allowed":{"type":"boolean","nullable":false},"lineage":{"type":"object","nullable":false}}},"payload":{"native":{"provider":"synthetic-provider","raw_ref":"fixture://core-chain/execution"},"records":[{"portfolio_id":"portfolio-001","as_of":"2026-08-10T09:30:00Z","simulated_orders":[{"instrument_id":"SYNTH-001","side":"buy","quantity":1,"order_type":"market"}],"constraints":["fixture-only"],"tca_assumptions":{"slippage_bps":0},"live_submission_allowed":false,"lineage":{"sources":[{"profile":"evaluation-result","version":"1.0.0","artifact_ref":"artifact://core-chain/evaluation","sha256":"sha256:a5e00610e698e8c6de133170f5a771376694ffa30bccf110d70b2b79cb568383"}],"evidence_refs":["evidence://core-chain/evaluation"]}}]},"quality":{"status":"pass","checks":["synthetic"],"warnings":[]}}
