{"$contract":{"envelope":"quantskills-envelope","envelope_version":"1.0.0","profile":"ranked-factor-set","profile_version":"1.0.0"},"meta":{"dataset_id":"core-chain-ranking","producer":"skill-factor-grouped-wrapper","generated_at":"2026-08-10T09:30:00Z","as_of":"2026-08-10T09:30:00Z","timezone":"UTC","currency":"CNY","calendar":"SYNX","provenance":[{"provider":"skill-factor-mining-pandaai","dataset":"factor-panel","raw_ref":"artifact://core-chain/factor-panel","raw_sha256":"sha256:4dad2ccfda2d46b859792bf688a89a6775b45ff581aea1821a03746cc4166e85"}]},"schema":{"primary_key":["set_id","factor_id"],"fields":{"set_id":{"type":"string","nullable":false},"as_of":{"type":"string","nullable":false,"format":"date-time"},"factor_id":{"type":"string","nullable":false},"rank":{"type":"integer","nullable":false,"unit":"rank"},"score":{"type":"number","nullable":false,"unit":"score"},"selection_method":{"type":"string","nullable":false},"evaluation_ref":{"type":"string","nullable":false},"lineage":{"type":"object","nullable":false}}},"payload":{"native":{"provider":"synthetic-provider","raw_ref":"fixture://core-chain/ranking"},"records":[{"set_id":"set-001","as_of":"2026-08-10T09:30:00Z","factor_id":"synthetic-factor","rank":1,"score":1.25,"selection_method":"top-k","evaluation_ref":"artifact://core-chain/evaluation","lineage":{"sources":[{"profile":"factor-panel","version":"1.0.0","artifact_ref":"artifact://core-chain/factor-panel","sha256":"sha256:4dad2ccfda2d46b859792bf688a89a6775b45ff581aea1821a03746cc4166e85"}],"evidence_refs":["evidence://core-chain/factor-panel"]}}]},"quality":{"status":"pass","checks":["synthetic"],"warnings":[]}}
