{"$contract":{"envelope":"quantskills-envelope","envelope_version":"1.0.0","profile":"ranked-factor-set","profile_version":"1.0.0"},"meta":{"dataset_id":"synthetic-ranked-factor-set","producer":"registry-fixture","generated_at":"2026-08-10T09:30:00Z","as_of":"2026-08-10T09:30:00Z","timezone":"UTC","currency":"CNY","calendar":"SYNX","provenance":[{"provider":"synthetic-provider","dataset":"ranked-factor-set","raw_ref":"fixture://ranked-factor-set/001","raw_sha256":"sha256:0000000000000000000000000000000000000000000000000000000000000000"}]},"schema":{"primary_key":["set_id","factor_id"],"fields":{"set_id":{"type":"string","nullable":false},"as_of":{"type":"string","nullable":false,"format":"date-time"},"factor_id":{"type":"string","nullable":false},"rank":{"type":"integer","nullable":false,"unit":"rank"},"score":{"type":"number","nullable":false,"unit":"score"},"selection_method":{"type":"string","nullable":false},"evaluation_ref":{"type":"string","nullable":false},"lineage":{"type":"object","nullable":false}}},"payload":{"native":{"provider":"synthetic-provider","raw_ref":"fixture://ranked-factor-set/001"},"records":[{"as_of":"2026-08-10T09:30:00Z","factor_id":"factor-001","rank":1,"score":1.25,"selection_method":"top-k","evaluation_ref":"artifact://evaluation/001","lineage":{"sources":[{"profile":"factor-panel","version":"1.0.0","artifact_ref":"artifact://factor-panel/001","sha256":"sha256:0000000000000000000000000000000000000000000000000000000000000000"}],"evidence_refs":["evidence://factor-panel/001"]}}]},"quality":{"status":"pass","checks":["synthetic"],"warnings":[]}}
