{"$contract":{"envelope":"quantskills-envelope","envelope_version":"1.0.0","profile":"backtest-result","profile_version":"1.0.0"},"meta":{"dataset_id":"synthetic-backtest-result","producer":"registry-fixture","generated_at":"2026-08-10T09:30:00Z","as_of":"2026-08-10T09:30:00Z","timezone":"UTC","currency":"CNY","calendar":"SYNX","provenance":[{"provider":"synthetic-provider","dataset":"backtest-result","raw_ref":"fixture://backtest-result/001","raw_sha256":"sha256:0000000000000000000000000000000000000000000000000000000000000000"}]},"schema":{"primary_key":["strategy_id","period_start","period_end"],"fields":{"strategy_id":{"type":"string","nullable":false},"period_start":{"type":"string","nullable":false,"format":"date"},"period_end":{"type":"string","nullable":false,"format":"date"},"return_series_ref":{"type":"string","nullable":false},"costs":{"type":"number","nullable":false,"unit":"currency"},"assumptions":{"type":"object","nullable":false},"bias_controls":{"type":"array","nullable":false},"lineage":{"type":"object","nullable":false}}},"payload":{"native":{"provider":"synthetic-provider","raw_ref":"fixture://backtest-result/001"},"records":[{"strategy_id":"strategy-001","period_start":"2026-01-01","period_end":"2026-06-30","return_series_ref":"artifact://returns/001","costs":12.5,"assumptions":{"slippage_bps":5},"bias_controls":["point-in-time"],"lineage":{"sources":[{"profile":"factor-panel","version":"1.0.0","artifact_ref":"artifact://factor-panel/001","sha256":"sha256:0000000000000000000000000000000000000000000000000000000000000000"}],"evidence_refs":["evidence://factor-panel/001"]}}]},"quality":{"status":"pass","checks":["synthetic"],"warnings":[]}}
