{"$contract":{"envelope":"quantskills-envelope","envelope_version":"1.0.0","profile":"portfolio-target","profile_version":"1.0.0"},"meta":{"dataset_id":"synthetic-portfolio-target","producer":"registry-fixture","generated_at":"2026-08-10T09:30:00Z","as_of":"2026-08-10T09:30:00Z","timezone":"UTC","currency":"CNY","calendar":"SYNX","provenance":[{"provider":"synthetic-provider","dataset":"portfolio-target","raw_ref":"fixture://portfolio-target/001","raw_sha256":"sha256:0000000000000000000000000000000000000000000000000000000000000000"}]},"schema":{"primary_key":["portfolio_id","as_of"],"fields":{"portfolio_id":{"type":"string","nullable":false},"as_of":{"type":"string","nullable":false,"format":"date-time"},"target_weights":{"type":"object","nullable":false},"cash_target":{"type":"number","nullable":false,"unit":"ratio"},"constraints":{"type":"array","nullable":false},"lineage":{"type":"object","nullable":false}}},"payload":{"native":{"provider":"synthetic-provider","raw_ref":"fixture://portfolio-target/001"},"records":[{"portfolio_id":"portfolio-001","as_of":"2026-08-10T09:30:00Z","target_weights":{"SYNTH-001":0.6},"cash_target":0.4,"constraints":["long-only"],"lineage":{"sources":[{"profile":"holdings","version":"1.0.0","artifact_ref":"artifact://holdings/001","sha256":"sha256:0000000000000000000000000000000000000000000000000000000000000000"}],"evidence_refs":["evidence://holdings/001"]}}]},"quality":{"status":"pass","checks":["synthetic"],"warnings":[]}}
