{"$contract":{"envelope":"quantskills-envelope","envelope_version":"1.0.0","profile":"market-bar","profile_version":"1.0.0"},"meta":{"dataset_id":"core-chain-market-bar","producer":"skill-pandadata-warehouse","generated_at":"2026-08-10T09:30:00Z","as_of":"2026-08-10T09:30:00Z","timezone":"UTC","currency":"CNY","calendar":"SYNX","provenance":[{"provider":"pandadata","dataset":"bars-daily","raw_ref":"fixture://pandadata/market-bar/001","raw_sha256":"sha256:4522f0923640a466e91ec61e1e7a988b384511e82637f6b54cd6febae154087f"}]},"schema":{"primary_key":["instrument_id","timestamp"],"fields":{"instrument_id":{"type":"string","nullable":false},"timestamp":{"type":"string","nullable":false,"format":"date-time"},"open":{"type":"number","nullable":false,"unit":"currency"},"high":{"type":"number","nullable":false,"unit":"currency"},"low":{"type":"number","nullable":false,"unit":"currency"},"close":{"type":"number","nullable":false,"unit":"currency"},"volume":{"type":"number","nullable":false,"unit":"shares"},"frequency":{"type":"string","nullable":false},"adjustment":{"type":"string","nullable":false},"calendar":{"type":"string","nullable":false}}},"payload":{"native":{"provider":"pandadata","raw_ref":"fixture://pandadata/market-bar/001"},"records":[{"instrument_id":"SYNTH-001","timestamp":"2026-08-10T09:30:00Z","open":10,"high":11,"low":9,"close":10.5,"volume":1000,"frequency":"1d","adjustment":"none","calendar":"SYNX"}]},"quality":{"status":"pass","checks":["synthetic"],"warnings":[]}}
