{"$contract":{"envelope":"quantskills-envelope","envelope_version":"1.0.0","profile":"futures-contract","profile_version":"1.0.0"},"meta":{"dataset_id":"synthetic-futures-contract","producer":"registry-fixture","generated_at":"2026-08-10T09:30:00Z","as_of":"2026-08-10T09:30:00Z","timezone":"UTC","currency":"CNY","calendar":"SYNX","provenance":[{"provider":"synthetic-provider","dataset":"futures-contract","raw_ref":"fixture://futures-contract/001","raw_sha256":"sha256:0123456789abcdef0123456789abcdef0123456789abcdef0123456789abcdef"}]},"schema":{"primary_key":["exchange","contract_id","trade_date"],"fields":{"exchange":{"type":"string","nullable":false},"contract_id":{"type":"string","nullable":false},"trade_date":{"type":"string","nullable":false,"format":"date"},"settlement":{"type":"number","nullable":false,"unit":"CNY"},"open_interest":{"type":"number","nullable":false,"unit":"contracts"},"expiry":{"type":"string","nullable":false,"format":"date"},"delivery_terms":{"type":"string","nullable":false},"continuous_series_id":{"type":"string","nullable":false},"roll_rule":{"type":"string","nullable":false}}},"payload":{"native":{"provider":"synthetic-provider","raw_ref":"fixture://futures-contract/001"},"records":[{"exchange":"SYNX","contract_id":"SYNX-202612","trade_date":"2026-08-10","settlement":100,"open_interest":500,"expiry":"2026-12-31","delivery_terms":"cash","continuous_series_id":"SYNX-1","roll_rule":"calendar"}]},"quality":{"status":"pass","checks":["synthetic"],"warnings":[]}}
