{"$contract":{"envelope":"quantskills-envelope","envelope_version":"1.0.0","profile":"macro-series","profile_version":"1.0.0"},"meta":{"dataset_id":"synthetic-macro-series","producer":"registry-fixture","generated_at":"2026-08-10T09:30:00Z","as_of":"2026-08-10T09:30:00Z","timezone":"UTC","currency":"CNY","calendar":"SYNX","provenance":[{"provider":"synthetic-provider","dataset":"macro-series","raw_ref":"fixture://macro-series/001","raw_sha256":"sha256:0123456789abcdef0123456789abcdef0123456789abcdef0123456789abcdef"}]},"schema":{"primary_key":["series_id","observation_date","vintage_date"],"fields":{"series_id":{"type":"string","nullable":false},"observation_date":{"type":"string","nullable":false,"format":"date"},"vintage_date":{"type":"string","nullable":false,"format":"date"},"value":{"type":"number","nullable":false,"unit":"index"},"frequency":{"type":"string","nullable":false},"unit":{"type":"string","nullable":false},"seasonal_adjustment":{"type":"string","nullable":false}}},"payload":{"native":{"provider":"synthetic-provider","raw_ref":"fixture://macro-series/001"},"records":[{"series_id":"SYNTH-MACRO","observation_date":"2026-08-01","vintage_date":"2026-08-10","value":101,"frequency":"monthly","unit":"index","seasonal_adjustment":"seasonally-adjusted"}]},"quality":{"status":"pass","checks":["synthetic"],"warnings":[]}}
