{"$contract":{"envelope":"quantskills-envelope","envelope_version":"1.0.0","profile":"market-bar","profile_version":"1.0.0"},"meta":{"calendar":"SSE","currency":"CNY","dataset_id":"bars-daily","generated_at":"2026-08-10T01:00:00Z","producer":"pandadata-synthetic","provenance":[{"dataset":"bars-daily","provider":"pandadata","raw_ref":"fixture://pandadata/market-bar/001","raw_sha256":"sha256:4522f0923640a466e91ec61e1e7a988b384511e82637f6b54cd6febae154087f"}],"timezone":"Asia/Shanghai"},"payload":{"native":{"provider":"pandadata","raw_records":[{"adjustment":"none","close":10.5,"high":11.0,"instrument":"000001.SZ","low":9.0,"native_note":"unmapped-market","open":10.0,"source_timestamp":"2026-08-10T09:30:00+08:00","volume":1000.0,"volume_unit":"shares"}],"raw_ref":"fixture://pandadata/market-bar/001"},"records":[{"adjustment":"none","calendar":"SSE","close":10.5,"frequency":"1d","high":11.0,"instrument_id":"000001.SZ","low":9.0,"open":10.0,"timestamp":"2026-08-10T09:30:00+08:00","volume":1000.0}]},"quality":{"checks":["lossless-native-recovery"],"status":"pass","warnings":[]},"schema":{"fields":{"adjustment":{"nullable":false,"type":"string"},"calendar":{"nullable":false,"type":"string"},"close":{"nullable":false,"type":"number","unit":"currency"},"frequency":{"nullable":false,"type":"string"},"high":{"nullable":false,"type":"number","unit":"currency"},"instrument_id":{"nullable":false,"type":"string"},"low":{"nullable":false,"type":"number","unit":"currency"},"open":{"nullable":false,"type":"number","unit":"currency"},"timestamp":{"format":"date-time","nullable":false,"type":"string"},"volume":{"nullable":false,"type":"number","unit":"shares"}},"primary_key":["instrument_id","timestamp"]}}
