{"$contract":{"envelope":"quantskills-envelope","envelope_version":"1.0.0","profile":"option-chain","profile_version":"1.0.0"},"meta":{"dataset_id":"synthetic-option-chain","producer":"registry-fixture","generated_at":"2026-08-10T09:30:00Z","as_of":"2026-08-10T09:30:00Z","timezone":"UTC","currency":"CNY","calendar":"SYNX","provenance":[{"provider":"synthetic-provider","dataset":"option-chain","raw_ref":"fixture://option-chain/001","raw_sha256":"sha256:0123456789abcdef0123456789abcdef0123456789abcdef0123456789abcdef"}]},"schema":{"primary_key":["underlying_id","quote_time","expiry","strike","option_type"],"fields":{"underlying_id":{"type":"string","nullable":false},"quote_time":{"type":"string","nullable":false,"format":"date-time"},"expiry":{"type":"string","nullable":false,"format":"date"},"strike":{"type":"number","nullable":false,"unit":"currency"},"option_type":{"type":"string","nullable":false},"bid":{"type":"number","nullable":false,"unit":"currency"},"ask":{"type":"number","nullable":false,"unit":"currency"},"implied_volatility":{"type":"number","nullable":false,"unit":"ratio"},"contract_multiplier":{"type":"number","nullable":false,"unit":"contracts"},"exercise_style":{"type":"string","nullable":false}}},"payload":{"native":{"provider":"synthetic-provider","raw_ref":"fixture://option-chain/001"},"records":[{"underlying_id":"SYNTH-001","quote_time":"2026-08-10T09:30:00Z","expiry":"2026-12-31","strike":10,"option_type":"call","bid":1,"ask":1.2,"implied_volatility":0.2,"contract_multiplier":100,"exercise_style":"european"}]},"quality":{"status":"pass","checks":["synthetic"],"warnings":[]}}
